book,chapter,verse,ref,label,note,text
Leviticus,23,8,Leviticus 23:8,law-wisdom,feast law,But ye shall offer an offering made by fire unto the LORD seven days: in the seventh day is an holy convocation: ye shall do no servile work therein.
Proverbs,1,1,Proverbs 1:1,law-wisdom,purpose of proverbs,"The proverbs of Solomon the son of David, king of Israel;"
Proverbs,1,2,Proverbs 1:2,law-wisdom,purpose of proverbs,To know wisdom and instruction; to perceive the words of understanding;
Proverbs,1,3,Proverbs 1:3,law-wisdom,purpose of proverbs,"To receive the instruction of wisdom, justice, and judgment, and equity;"
Proverbs,1,4,Proverbs 1:4,law-wisdom,purpose of proverbs,"To give subtilty to the simple, to the young man knowledge and discretion."
Proverbs,1,5,Proverbs 1:5,law-wisdom,purpose of proverbs,"A wise man will hear, and will increase learning; and a man of understanding shall attain unto wise counsels:"
Proverbs,1,6,Proverbs 1:6,law-wisdom,purpose of proverbs,"To understand a proverb, and the interpretation; the words of the wise, and their dark sayings."
Proverbs,1,7,Proverbs 1:7,law-wisdom,purpose of proverbs,The fear of the LORD is the beginning of knowledge: but fools despise wisdom and instruction.
Proverbs,3,1,Proverbs 3:1,law-wisdom,wisdom instruction,"My son, forget not my law; but let thine heart keep my commandments:"
Proverbs,3,2,Proverbs 3:2,law-wisdom,wisdom instruction,"For length of days, and long life, and peace, shall they add to thee."
Proverbs,3,3,Proverbs 3:3,law-wisdom,wisdom instruction,Let not mercy and truth forsake thee: bind them about thy neck; write them upon the table of thine heart:
Proverbs,3,4,Proverbs 3:4,law-wisdom,wisdom instruction,So shalt thou find favour and good understanding in the sight of God and man.
Proverbs,3,5,Proverbs 3:5,law-wisdom,wisdom instruction,Trust in the LORD with all thine heart; and lean not unto thine own understanding.
Proverbs,3,6,Proverbs 3:6,law-wisdom,wisdom instruction,"In all thy ways acknowledge him, and he shall direct thy paths."
Proverbs,3,7,Proverbs 3:7,law-wisdom,wisdom instruction,"Be not wise in thine own eyes: fear the LORD, and depart from evil."
Proverbs,3,8,Proverbs 3:8,law-wisdom,wisdom instruction,"It shall be health to thy navel, and marrow to thy bones."
Proverbs,3,9,Proverbs 3:9,law-wisdom,wisdom instruction,"Honour the LORD with thy substance, and with the firstfruits of all thine increase:"
Proverbs,3,10,Proverbs 3:10,law-wisdom,wisdom instruction,"So shall thy barns be filled with plenty, and thy presses shall burst out with new wine."
Proverbs,3,11,Proverbs 3:11,law-wisdom,wisdom instruction,"My son, despise not the chastening of the LORD; neither be weary of his correction:"
Proverbs,3,12,Proverbs 3:12,law-wisdom,wisdom instruction,For whom the LORD loveth he correcteth; even as a father the son in whom he delighteth.
Proverbs,6,6,Proverbs 6:6,law-wisdom,sluggard wisdom saying,"Go to the ant, thou sluggard; consider her ways, and be wise:"
Proverbs,6,7,Proverbs 6:7,law-wisdom,sluggard wisdom saying,"Which having no guide, overseer, or ruler,"
Proverbs,6,8,Proverbs 6:8,law-wisdom,sluggard wisdom saying,"Provideth her meat in the summer, and gathereth her food in the harvest."
Proverbs,6,9,Proverbs 6:9,law-wisdom,sluggard wisdom saying,"How long wilt thou sleep, O sluggard? when wilt thou arise out of thy sleep?"
Proverbs,6,10,Proverbs 6:10,law-wisdom,sluggard wisdom saying,"Yet a little sleep, a little slumber, a little folding of the hands to sleep:"
Proverbs,6,11,Proverbs 6:11,law-wisdom,sluggard wisdom saying,"So shall thy poverty come as one that travelleth, and thy want as an armed man."
Proverbs,31,10,Proverbs 31:10,law-wisdom,virtuous woman,Who can find a virtuous woman? for her price is far above rubies.
Proverbs,31,11,Proverbs 31:11,law-wisdom,virtuous woman,"The heart of her husband doth safely trust in her, so that he shall have no need of spoil."
Proverbs,31,12,Proverbs 31:12,law-wisdom,virtuous woman,She will do him good and not evil all the days of her life.
Proverbs,31,13,Proverbs 31:13,law-wisdom,virtuous woman,"She seeketh wool, and flax, and worketh willingly with her hands."
Proverbs,31,14,Proverbs 31:14,law-wisdom,virtuous woman,She is like the merchants’ ships; she bringeth her food from afar.
Proverbs,31,15,Proverbs 31:15,law-wisdom,virtuous woman,"She riseth also while it is yet night, and giveth meat to her household, and a portion to her maidens."
Proverbs,31,16,Proverbs 31:16,law-wisdom,virtuous woman,"She considereth a field, and buyeth it: with the fruit of her hands she planteth a vineyard."
Proverbs,31,17,Proverbs 31:17,law-wisdom,virtuous woman,"She girdeth her loins with strength, and strengtheneth her arms."
Proverbs,31,18,Proverbs 31:18,law-wisdom,virtuous woman,She perceiveth that her merchandise is good: her candle goeth not out by night.
Proverbs,31,19,Proverbs 31:19,law-wisdom,virtuous woman,"She layeth her hands to the spindle, and her hands hold the distaff."
Proverbs,31,20,Proverbs 31:20,law-wisdom,virtuous woman,"She stretcheth out her hand to the poor; yea, she reacheth forth her hands to the needy."
Proverbs,31,21,Proverbs 31:21,law-wisdom,virtuous woman,She is not afraid of the snow for her household: for all her household are clothed with scarlet.
Proverbs,31,22,Proverbs 31:22,law-wisdom,virtuous woman,She maketh herself coverings of tapestry; her clothing is silk and purple.
Proverbs,31,23,Proverbs 31:23,law-wisdom,virtuous woman,"Her husband is known in the gates, when he sitteth among the elders of the land."
Proverbs,31,24,Proverbs 31:24,law-wisdom,virtuous woman,"She maketh fine linen, and selleth it; and delivereth girdles unto the merchant."
Proverbs,31,25,Proverbs 31:25,law-wisdom,virtuous woman,Strength and honour are her clothing; and she shall rejoice in time to come.
Proverbs,31,26,Proverbs 31:26,law-wisdom,virtuous woman,She openeth her mouth with wisdom; and in her tongue is the law of kindness.
Proverbs,31,27,Proverbs 31:27,law-wisdom,virtuous woman,"She looketh well to the ways of her household, and eateth not the bread of idleness."
Proverbs,31,28,Proverbs 31:28,law-wisdom,virtuous woman,"Her children arise up, and call her blessed; her husband also, and he praiseth her."
Proverbs,31,29,Proverbs 31:29,law-wisdom,virtuous woman,"Many daughters have done virtuously, but thou excellest them all."
Proverbs,31,30,Proverbs 31:30,law-wisdom,virtuous woman,"Favour is deceitful, and beauty is vain: but a woman that feareth the LORD, she shall be praised."
Proverbs,31,31,Proverbs 31:31,law-wisdom,virtuous woman,Give her of the fruit of her hands; and let her own works praise her in the gates.
