book,chapter,verse,ref,label,note,text
Isaiah,1,2,Isaiah 1:2,prophetic,"opening oracle, divine-speech formula","Hear, O heavens, and give ear, O earth: for the LORD hath spoken, I have nourished and brought up children, and they have rebelled against me."
Isaiah,1,3,Isaiah 1:3,prophetic,"opening oracle, divine-speech formula","The ox knoweth his owner, and the ass his master’s crib: but Israel doth not know, my people doth not consider."
Isaiah,1,4,Isaiah 1:4,prophetic,"opening oracle, divine-speech formula","Ah sinful nation, a people laden with iniquity, a seed of evildoers, children that are corrupters: they have forsaken the LORD, they have provoked the Holy One of Israel unto anger, they are gone away backward."
Isaiah,6,9,Isaiah 6:9,prophetic,call vision,"And he said, Go, and tell this people, Hear ye indeed, but understand not; and see ye indeed, but perceive not."
Isaiah,6,10,Isaiah 6:10,prophetic,call vision,"Make the heart of this people fat, and make their ears heavy, and shut their eyes; lest they see with their eyes, and hear with their ears, and understand with their heart, and convert, and be healed."
Isaiah,6,11,Isaiah 6:11,prophetic,call vision,"Then said I, Lord, how long? And he answered, Until the cities be wasted without inhabitant, and the houses without man, and the land be utterly desolate,"
Isaiah,6,12,Isaiah 6:12,prophetic,call vision,"And the LORD have removed men far away, and there be a great forsaking in the midst of the land."
Isaiah,6,13,Isaiah 6:13,prophetic,call vision,"But yet in it shall be a tenth, and it shall return, and shall be eaten: as a teil tree, and as an oak, whose substance is in them, when they cast their leaves: so the holy seed shall be the substance thereof."
Isaiah,53,1,Isaiah 53:1,prophetic,messianic prophecy,Who hath believed our report? and to whom is the arm of the LORD revealed?
Isaiah,53,2,Isaiah 53:2,prophetic,messianic prophecy,"For he shall grow up before him as a tender plant, and as a root out of a dry ground: he hath no form nor comeliness; and when we shall see him, there is no beauty that we should desire him."
Isaiah,53,3,Isaiah 53:3,prophetic,messianic prophecy,"He is despised and rejected of men; a man of sorrows, and acquainted with grief: and we hid as it were our faces from him; he was despised, and we esteemed him not."
Isaiah,53,4,Isaiah 53:4,prophetic,messianic prophecy,"Surely he hath borne our griefs, and carried our sorrows: yet we did esteem him stricken, smitten of God, and afflicted."
Isaiah,53,5,Isaiah 53:5,prophetic,messianic prophecy,"But he was wounded for our transgressions, he was bruised for our iniquities: the chastisement of our peace was upon him; and with his stripes we are healed."
Isaiah,53,6,Isaiah 53:6,prophetic,messianic prophecy,All we like sheep have gone astray; we have turned every one to his own way; and the LORD hath laid on him the iniquity of us all.
Isaiah,53,7,Isaiah 53:7,prophetic,messianic prophecy,"He was oppressed, and he was afflicted, yet he opened not his mouth: he is brought as a lamb to the slaughter, and as a sheep before her shearers is dumb, so he openeth not his mouth."
Isaiah,53,8,Isaiah 53:8,prophetic,messianic prophecy,He was taken from prison and from judgment: and who shall declare his generation? for he was cut off out of the land of the living: for the transgression of my people was he stricken.
Isaiah,53,9,Isaiah 53:9,prophetic,messianic prophecy,"And he made his grave with the wicked, and with the rich in his death; because he had done no violence, neither was any deceit in his mouth."
Isaiah,53,10,Isaiah 53:10,prophetic,messianic prophecy,"Yet it pleased the LORD to bruise him; he hath put him to grief: when thou shalt make his soul an offering for sin, he shall see his seed, he shall prolong his days, and the pleasure of the LORD shall prosper in his hand."
Isaiah,53,11,Isaiah 53:11,prophetic,messianic prophecy,"He shall see of the travail of his soul, and shall be satisfied: by his knowledge shall my righteous servant justify many; for he shall bear their iniquities."
Isaiah,53,12,Isaiah 53:12,prophetic,messianic prophecy,"Therefore will I divide him a portion with the great, and he shall divide the spoil with the strong; because he hath poured out his soul unto death: and he was numbered with the transgressors; and he bare the sin of many, and made intercession for the transgressors."
Jeremiah,1,4,Jeremiah 1:4,prophetic,"prophetic call, divine speech","Then the word of the LORD came unto me, saying,"
Jeremiah,1,5,Jeremiah 1:5,prophetic,"prophetic call, divine speech","Before I formed thee in the belly I knew thee; and before thou camest forth out of the womb I sanctified thee, and I ordained thee a prophet unto the nations."
Jeremiah,1,6,Jeremiah 1:6,prophetic,"prophetic call, divine speech","Then said I, Ah, Lord GOD! behold, I cannot speak: for I am a child."
Jeremiah,1,7,Jeremiah 1:7,prophetic,"prophetic call, divine speech","But the LORD said unto me, Say not, I am a child: for thou shalt go to all that I shall send thee, and whatsoever I command thee thou shalt speak."
Jeremiah,1,8,Jeremiah 1:8,prophetic,"prophetic call, divine speech","Be not afraid of their faces: for I am with thee to deliver thee, saith the LORD."
Jeremiah,1,9,Jeremiah 1:9,prophetic,"prophetic call, divine speech","Then the LORD put forth his hand, and touched my mouth. And the LORD said unto me, Behold, I have put my words in thy mouth."
Jeremiah,1,10,Jeremiah 1:10,prophetic,"prophetic call, divine speech","See, I have this day set thee over the nations and over the kingdoms, to root out, and to pull down, and to destroy, and to throw down, to build, and to plant."
Jeremiah,7,1,Jeremiah 7:1,prophetic,"temple sermon, 'thus saith the LORD'","The word that came to Jeremiah from the LORD, saying,"
Jeremiah,7,2,Jeremiah 7:2,prophetic,"temple sermon, 'thus saith the LORD'","Stand in the gate of the LORD’s house, and proclaim there this word, and say, Hear the word of the LORD, all ye of Judah, that enter in at these gates to worship the LORD."
Jeremiah,7,3,Jeremiah 7:3,prophetic,"temple sermon, 'thus saith the LORD'","Thus saith the LORD of hosts, the God of Israel, Amend your ways and your doings, and I will cause you to dwell in this place."
Jeremiah,7,4,Jeremiah 7:4,prophetic,"temple sermon, 'thus saith the LORD'","Trust ye not in lying words, saying, The temple of the LORD, The temple of the LORD, The temple of the LORD, are these."
Jeremiah,7,5,Jeremiah 7:5,prophetic,"temple sermon, 'thus saith the LORD'",For if ye throughly amend your ways and your doings; if ye throughly execute judgment between a man and his neighbour;
Jeremiah,7,6,Jeremiah 7:6,prophetic,"temple sermon, 'thus saith the LORD'","If ye oppress not the stranger, the fatherless, and the widow, and shed not innocent blood in this place, neither walk after other gods to your hurt:"
Jeremiah,7,7,Jeremiah 7:7,prophetic,"temple sermon, 'thus saith the LORD'","Then will I cause you to dwell in this place, in the land that I gave to your fathers, for ever and ever."
Jeremiah,7,8,Jeremiah 7:8,prophetic,"temple sermon, 'thus saith the LORD'","Behold, ye trust in lying words, that cannot profit."
Jeremiah,7,9,Jeremiah 7:9,prophetic,"temple sermon, 'thus saith the LORD'","Will ye steal, murder, and commit adultery, and swear falsely, and burn incense unto Baal, and walk after other gods whom ye know not;"
Jeremiah,7,10,Jeremiah 7:10,prophetic,"temple sermon, 'thus saith the LORD'","And come and stand before me in this house, which is called by my name, and say, We are delivered to do all these abominations?"
Jeremiah,7,11,Jeremiah 7:11,prophetic,"temple sermon, 'thus saith the LORD'","Is this house, which is called by my name, become a den of robbers in your eyes? Behold, even I have seen it, saith the LORD."
Ezekiel,2,1,Ezekiel 2:1,prophetic,"call, 'thus saith the Lord GOD'","And he said unto me, Son of man, stand upon thy feet, and I will speak unto thee."
Ezekiel,2,2,Ezekiel 2:2,prophetic,"call, 'thus saith the Lord GOD'","And the spirit entered into me when he spake unto me, and set me upon my feet, that I heard him that spake unto me."
Ezekiel,2,3,Ezekiel 2:3,prophetic,"call, 'thus saith the Lord GOD'","And he said unto me, Son of man, I send thee to the children of Israel, to a rebellious nation that hath rebelled against me: they and their fathers have transgressed against me, even unto this very day."
Ezekiel,2,4,Ezekiel 2:4,prophetic,"call, 'thus saith the Lord GOD'","For they are impudent children and stiffhearted. I do send thee unto them; and thou shalt say unto them, Thus saith the Lord GOD."
Ezekiel,2,5,Ezekiel 2:5,prophetic,"call, 'thus saith the Lord GOD'","And they, whether they will hear, or whether they will forbear, (for they are a rebellious house,) yet shall know that there hath been a prophet among them."
Ezekiel,2,6,Ezekiel 2:6,prophetic,"call, 'thus saith the Lord GOD'","And thou, son of man, be not afraid of them, neither be afraid of their words, though briers and thorns be with thee, and thou dost dwell among scorpions: be not afraid of their words, nor be dismayed at their looks, though they be a rebellious house."
Ezekiel,2,7,Ezekiel 2:7,prophetic,"call, 'thus saith the Lord GOD'","And thou shalt speak my words unto them, whether they will hear, or whether they will forbear: for they are most rebellious."
Ezekiel,37,1,Ezekiel 37:1,prophetic,valley of dry bones oracle,"The hand of the LORD was upon me, and carried me out in the spirit of the LORD, and set me down in the midst of the valley which was full of bones,"
Ezekiel,37,2,Ezekiel 37:2,prophetic,valley of dry bones oracle,"And caused me to pass by them round about: and, behold, there were very many in the open valley; and, lo, they were very dry."
Ezekiel,37,3,Ezekiel 37:3,prophetic,valley of dry bones oracle,"And he said unto me, Son of man, can these bones live? And I answered, O Lord GOD, thou knowest."
Ezekiel,37,4,Ezekiel 37:4,prophetic,valley of dry bones oracle,"Again he said unto me, Prophesy upon these bones, and say unto them, O ye dry bones, hear the word of the LORD."
Ezekiel,37,5,Ezekiel 37:5,prophetic,valley of dry bones oracle,"Thus saith the Lord GOD unto these bones; Behold, I will cause breath to enter into you, and ye shall live:"
Ezekiel,37,6,Ezekiel 37:6,prophetic,valley of dry bones oracle,"And I will lay sinews upon you, and will bring up flesh upon you, and cover you with skin, and put breath in you, and ye shall live; and ye shall know that I am the LORD."
Ezekiel,37,7,Ezekiel 37:7,prophetic,valley of dry bones oracle,"So I prophesied as I was commanded: and as I prophesied, there was a noise, and behold a shaking, and the bones came together, bone to his bone."
Ezekiel,37,8,Ezekiel 37:8,prophetic,valley of dry bones oracle,"And when I beheld, lo, the sinews and the flesh came up upon them, and the skin covered them above: but there was no breath in them."
Ezekiel,37,9,Ezekiel 37:9,prophetic,valley of dry bones oracle,"Then said he unto me, Prophesy unto the wind, prophesy, son of man, and say to the wind, Thus saith the Lord GOD; Come from the four winds, O breath, and breathe upon these slain, that they may live."
Ezekiel,37,10,Ezekiel 37:10,prophetic,valley of dry bones oracle,"So I prophesied as he commanded me, and the breath came into them, and they lived, and stood up upon their feet, an exceeding great army."
Ezekiel,37,11,Ezekiel 37:11,prophetic,valley of dry bones oracle,"Then he said unto me, Son of man, these bones are the whole house of Israel: behold, they say, Our bones are dried, and our hope is lost: we are cut off for our parts."
Ezekiel,37,12,Ezekiel 37:12,prophetic,valley of dry bones oracle,"Therefore prophesy and say unto them, Thus saith the Lord GOD; Behold, O my people, I will open your graves, and cause you to come up out of your graves, and bring you into the land of Israel."
Ezekiel,37,13,Ezekiel 37:13,prophetic,valley of dry bones oracle,"And ye shall know that I am the LORD, when I have opened your graves, O my people, and brought you up out of your graves,"
Ezekiel,37,14,Ezekiel 37:14,prophetic,valley of dry bones oracle,"And shall put my spirit in you, and ye shall live, and I shall place you in your own land: then shall ye know that I the LORD have spoken it, and performed it, saith the LORD."
Amos,1,3,Amos 1:3,prophetic,'for three transgressions' judgment oracle,"Thus saith the LORD; For three transgressions of Damascus, and for four, I will not turn away the punishment thereof; because they have threshed Gilead with threshing instruments of iron:"
Amos,1,4,Amos 1:4,prophetic,'for three transgressions' judgment oracle,"But I will send a fire into the house of Hazael, which shall devour the palaces of Benhadad."
Amos,1,5,Amos 1:5,prophetic,'for three transgressions' judgment oracle,"I will break also the bar of Damascus, and cut off the inhabitant from the plain of Aven, and him that holdeth the sceptre from the house of Eden: and the people of Syria shall go into captivity unto Kir, saith the LORD."
Micah,5,2,Micah 5:2,prophetic,messianic prophecy (Bethlehem),"But thou, Bethlehem Ephratah, though thou be little among the thousands of Judah, yet out of thee shall he come forth unto me that is to be ruler in Israel; whose goings forth have been from of old, from everlasting."
Micah,5,3,Micah 5:3,prophetic,messianic prophecy (Bethlehem),"Therefore will he give them up, until the time that she which travaileth hath brought forth: then the remnant of his brethren shall return unto the children of Israel."
Micah,5,4,Micah 5:4,prophetic,messianic prophecy (Bethlehem),"And he shall stand and feed in the strength of the LORD, in the majesty of the name of the LORD his God; and they shall abide: for now shall he be great unto the ends of the earth."
Joel,2,28,Joel 2:28,prophetic,'I will pour out my spirit' oracle,"And it shall come to pass afterward, that I will pour out my spirit upon all flesh; and your sons and your daughters shall prophesy, your old men shall dream dreams, your young men shall see visions:"
Joel,2,29,Joel 2:29,prophetic,'I will pour out my spirit' oracle,And also upon the servants and upon the handmaids in those days will I pour out my spirit.
Joel,2,30,Joel 2:30,prophetic,'I will pour out my spirit' oracle,"And I will shew wonders in the heavens and in the earth, blood, and fire, and pillars of smoke."
Joel,2,31,Joel 2:31,prophetic,'I will pour out my spirit' oracle,"The sun shall be turned into darkness, and the moon into blood, before the great and the terrible day of the LORD come."
Joel,2,32,Joel 2:32,prophetic,'I will pour out my spirit' oracle,"And it shall come to pass, that whosoever shall call on the name of the LORD shall be delivered: for in mount Zion and in Jerusalem shall be deliverance, as the LORD hath said, and in the remnant whom the LORD shall call."
Zephaniah,1,14,Zephaniah 1:14,prophetic,day-of-the-LORD oracle,"The great day of the LORD is near, it is near, and hasteth greatly, even the voice of the day of the LORD: the mighty man shall cry there bitterly."
Zephaniah,1,15,Zephaniah 1:15,prophetic,day-of-the-LORD oracle,"That day is a day of wrath, a day of trouble and distress, a day of wasteness and desolation, a day of darkness and gloominess, a day of clouds and thick darkness,"
Zephaniah,1,16,Zephaniah 1:16,prophetic,day-of-the-LORD oracle,"A day of the trumpet and alarm against the fenced cities, and against the high towers."
Zephaniah,1,17,Zephaniah 1:17,prophetic,day-of-the-LORD oracle,"And I will bring distress upon men, that they shall walk like blind men, because they have sinned against the LORD: and their blood shall be poured out as dust, and their flesh as the dung."
Zephaniah,1,18,Zephaniah 1:18,prophetic,day-of-the-LORD oracle,Neither their silver nor their gold shall be able to deliver them in the day of the LORD’s wrath; but the whole land shall be devoured by the fire of his jealousy: for he shall make even a speedy riddance of all them that dwell in the land.
Habakkuk,2,2,Habakkuk 2:2,prophetic,'write the vision' oracle,"And the LORD answered me, and said, Write the vision, and make it plain upon tables, that he may run that readeth it."
Habakkuk,2,3,Habakkuk 2:3,prophetic,'write the vision' oracle,"For the vision is yet for an appointed time, but at the end it shall speak, and not lie: though it tarry, wait for it; because it will surely come, it will not tarry."
Habakkuk,2,4,Habakkuk 2:4,prophetic,'write the vision' oracle,"Behold, his soul which is lifted up is not upright in him: but the just shall live by his faith."
Zechariah,9,9,Zechariah 9:9,prophetic,messianic prophecy (triumphant king),"Rejoice greatly, O daughter of Zion; shout, O daughter of Jerusalem: behold, thy King cometh unto thee: he is just, and having salvation; lowly, and riding upon an ass, and upon a colt the foal of an ass."
Zechariah,9,10,Zechariah 9:10,prophetic,messianic prophecy (triumphant king),"And I will cut off the chariot from Ephraim, and the horse from Jerusalem, and the battle bow shall be cut off: and he shall speak peace unto the heathen: and his dominion shall be from sea even to sea, and from the river even to the ends of the earth."
Malachi,3,1,Malachi 3:1,prophetic,messenger oracle,"Behold, I will send my messenger, and he shall prepare the way before me: and the LORD, whom ye seek, shall suddenly come to his temple, even the messenger of the covenant, whom ye delight in: behold, he shall come, saith the LORD of hosts."
Malachi,3,2,Malachi 3:2,prophetic,messenger oracle,"But who may abide the day of his coming? and who shall stand when he appeareth? for he is like a refiner’s fire, and like fullers’ soap:"
Malachi,3,3,Malachi 3:3,prophetic,messenger oracle,"And he shall sit as a refiner and purifier of silver: and he shall purify the sons of Levi, and purge them as gold and silver, that they may offer unto the LORD an offering in righteousness."
Daniel,9,24,Daniel 9:24,prophetic,seventy weeks prophecy,"Seventy weeks are determined upon thy people and upon thy holy city, to finish the transgression, and to make an end of sins, and to make reconciliation for iniquity, and to bring in everlasting righteousness, and to seal up the vision and prophecy, and to anoint the most Holy."
Daniel,9,25,Daniel 9:25,prophetic,seventy weeks prophecy,"Know therefore and understand, that from the going forth of the commandment to restore and to build Jerusalem unto the Messiah the Prince shall be seven weeks, and threescore and two weeks: the street shall be built again, and the wall, even in troublous times."
Daniel,9,26,Daniel 9:26,prophetic,seventy weeks prophecy,"And after threescore and two weeks shall Messiah be cut off, but not for himself: and the people of the prince that shall come shall destroy the city and the sanctuary; and the end thereof shall be with a flood, and unto the end of the war desolations are determined."
Daniel,9,27,Daniel 9:27,prophetic,seventy weeks prophecy,"And he shall confirm the covenant with many for one week: and in the midst of the week he shall cause the sacrifice and the oblation to cease, and for the overspreading of abominations he shall make it desolate, even until the consummation, and that determined shall be poured upon the desolate."
Psalms,22,1,Psalms 22:1,prophetic,messianic psalm,"My God, my God, why hast thou forsaken me? why art thou so far from helping me, and from the words of my roaring?"
Psalms,22,2,Psalms 22:2,prophetic,messianic psalm,"O my God, I cry in the day time, but thou hearest not; and in the night season, and am not silent."
Psalms,22,3,Psalms 22:3,prophetic,messianic psalm,"But thou art holy, O thou that inhabitest the praises of Israel."
Psalms,22,4,Psalms 22:4,prophetic,messianic psalm,"Our fathers trusted in thee: they trusted, and thou didst deliver them."
Psalms,22,5,Psalms 22:5,prophetic,messianic psalm,"They cried unto thee, and were delivered: they trusted in thee, and were not confounded."
Psalms,22,6,Psalms 22:6,prophetic,messianic psalm,"But I am a worm, and no man; a reproach of men, and despised of the people."
Psalms,22,7,Psalms 22:7,prophetic,messianic psalm,"All they that see me laugh me to scorn: they shoot out the lip, they shake the head, saying,"
Psalms,22,8,Psalms 22:8,prophetic,messianic psalm,"He trusted on the LORD that he would deliver him: let him deliver him, seeing he delighted in him."
Psalms,22,9,Psalms 22:9,prophetic,messianic psalm,But thou art he that took me out of the womb: thou didst make me hope when I was upon my mother’s breasts.
Psalms,22,10,Psalms 22:10,prophetic,messianic psalm,I was cast upon thee from the womb: thou art my God from my mother’s belly.
Psalms,22,11,Psalms 22:11,prophetic,messianic psalm,Be not far from me; for trouble is near; for there is none to help.
Psalms,22,12,Psalms 22:12,prophetic,messianic psalm,Many bulls have compassed me: strong bulls of Bashan have beset me round.
Psalms,22,13,Psalms 22:13,prophetic,messianic psalm,"They gaped upon me with their mouths, as a ravening and a roaring lion."
Psalms,22,14,Psalms 22:14,prophetic,messianic psalm,"I am poured out like water, and all my bones are out of joint: my heart is like wax; it is melted in the midst of my bowels."
Psalms,22,15,Psalms 22:15,prophetic,messianic psalm,My strength is dried up like a potsherd; and my tongue cleaveth to my jaws; and thou hast brought me into the dust of death.
Psalms,22,16,Psalms 22:16,prophetic,messianic psalm,For dogs have compassed me: the assembly of the wicked have inclosed me: they pierced my hands and my feet.
Psalms,22,17,Psalms 22:17,prophetic,messianic psalm,I may tell all my bones: they look and stare upon me.
Psalms,22,18,Psalms 22:18,prophetic,messianic psalm,"They part my garments among them, and cast lots upon my vesture."
Jude,1,14,Jude 1:14,prophetic,"Enoch's judgment oracle, explicitly framed as prophecy; near-verbatim quote of 1 Enoch 1:9","And Enoch also, the seventh from Adam, prophesied of these, saying, Behold, the Lord cometh with ten thousands of his saints,"
Jude,1,15,Jude 1:15,prophetic,"Enoch's judgment oracle, explicitly framed as prophecy; near-verbatim quote of 1 Enoch 1:9","To execute judgment upon all, and to convince all that are ungodly among them of all their ungodly deeds which they have ungodly committed, and of all their hard speeches which ungodly sinners have spoken against him."
Genesis,5,21,Genesis 5:21,narrative,Enoch: 'walked with God ... and he was not',"And Enoch lived sixty and five years, and begat Methuselah:"
Genesis,5,22,Genesis 5:22,narrative,Enoch: 'walked with God ... and he was not',"And Enoch walked with God after he begat Methuselah three hundred years, and begat sons and daughters:"
Genesis,5,23,Genesis 5:23,narrative,Enoch: 'walked with God ... and he was not',And all the days of Enoch were three hundred sixty and five years:
Genesis,5,24,Genesis 5:24,narrative,Enoch: 'walked with God ... and he was not',And Enoch walked with God: and he was not; for God took him.
Genesis,12,1,Genesis 12:1,narrative,"Abram's call and journey (narrated, not the oracle verses)","Now the LORD had said unto Abram, Get thee out of thy country, and from thy kindred, and from thy father’s house, unto a land that I will shew thee:"
Genesis,12,2,Genesis 12:2,narrative,"Abram's call and journey (narrated, not the oracle verses)","And I will make of thee a great nation, and I will bless thee, and make thy name great; and thou shalt be a blessing:"
Genesis,12,3,Genesis 12:3,narrative,"Abram's call and journey (narrated, not the oracle verses)","And I will bless them that bless thee, and curse him that curseth thee: and in thee shall all families of the earth be blessed."
Genesis,12,4,Genesis 12:4,narrative,"Abram's call and journey (narrated, not the oracle verses)","So Abram departed, as the LORD had spoken unto him; and Lot went with him: and Abram was seventy and five years old when he departed out of Haran."
Genesis,12,5,Genesis 12:5,narrative,"Abram's call and journey (narrated, not the oracle verses)","And Abram took Sarai his wife, and Lot his brother’s son, and all their substance that they had gathered, and the souls that they had gotten in Haran; and they went forth to go into the land of Canaan; and into the land of Canaan they came."
Genesis,12,6,Genesis 12:6,narrative,"Abram's call and journey (narrated, not the oracle verses)","And Abram passed through the land unto the place of Sichem, unto the plain of Moreh. And the Canaanite was then in the land."
Genesis,12,7,Genesis 12:7,narrative,"Abram's call and journey (narrated, not the oracle verses)","And the LORD appeared unto Abram, and said, Unto thy seed will I give this land: and there builded he an altar unto the LORD, who appeared unto him."
Genesis,12,8,Genesis 12:8,narrative,"Abram's call and journey (narrated, not the oracle verses)","And he removed from thence unto a mountain on the east of Bethel, and pitched his tent, having Bethel on the west, and Hai on the east: and there he builded an altar unto the LORD, and called upon the name of the LORD."
Genesis,12,9,Genesis 12:9,narrative,"Abram's call and journey (narrated, not the oracle verses)","And Abram journeyed, going on still toward the south."
Genesis,24,15,Genesis 24:15,narrative,Isaac and Rebekah at the well,"And it came to pass, before he had done speaking, that, behold, Rebekah came out, who was born to Bethuel, son of Milcah, the wife of Nahor, Abraham’s brother, with her pitcher upon her shoulder."
Genesis,24,16,Genesis 24:16,narrative,Isaac and Rebekah at the well,"And the damsel was very fair to look upon, a virgin, neither had any man known her: and she went down to the well, and filled her pitcher, and came up."
Genesis,24,17,Genesis 24:17,narrative,Isaac and Rebekah at the well,"And the servant ran to meet her, and said, Let me, I pray thee, drink a little water of thy pitcher."
