book,chapter,verse,ref,label,note,text
Genesis,24,18,Genesis 24:18,narrative,Isaac and Rebekah at the well,"And she said, Drink, my lord: and she hasted, and let down her pitcher upon her hand, and gave him drink."
Genesis,24,19,Genesis 24:19,narrative,Isaac and Rebekah at the well,"And when she had done giving him drink, she said, I will draw water for thy camels also, until they have done drinking."
Genesis,24,20,Genesis 24:20,narrative,Isaac and Rebekah at the well,"And she hasted, and emptied her pitcher into the trough, and ran again unto the well to draw water, and drew for all his camels."
Genesis,24,21,Genesis 24:21,narrative,Isaac and Rebekah at the well,"And the man wondering at her held his peace, to wit whether the LORD had made his journey prosperous or not."
Genesis,24,22,Genesis 24:22,narrative,Isaac and Rebekah at the well,"And it came to pass, as the camels had done drinking, that the man took a golden earring of half a shekel weight, and two bracelets for her hands of ten shekels weight of gold;"
Genesis,24,23,Genesis 24:23,narrative,Isaac and Rebekah at the well,"And said, Whose daughter art thou? tell me, I pray thee: is there room in thy father’s house for us to lodge in?"
Genesis,24,24,Genesis 24:24,narrative,Isaac and Rebekah at the well,"And she said unto him, I am the daughter of Bethuel the son of Milcah, which she bare unto Nahor."
Genesis,24,25,Genesis 24:25,narrative,Isaac and Rebekah at the well,"She said moreover unto him, We have both straw and provender enough, and room to lodge in."
Genesis,24,26,Genesis 24:26,narrative,Isaac and Rebekah at the well,"And the man bowed down his head, and worshipped the LORD."
Genesis,24,27,Genesis 24:27,narrative,Isaac and Rebekah at the well,"And he said, Blessed be the LORD God of my master Abraham, who hath not left destitute my master of his mercy and his truth: I being in the way, the LORD led me to the house of my master’s brethren."
Genesis,37,23,Genesis 37:23,narrative,Joseph sold into slavery,"And it came to pass, when Joseph was come unto his brethren, that they stript Joseph out of his coat, his coat of many colours that was on him;"
Genesis,37,24,Genesis 37:24,narrative,Joseph sold into slavery,"And they took him, and cast him into a pit: and the pit was empty, there was no water in it."
Genesis,37,25,Genesis 37:25,narrative,Joseph sold into slavery,"And they sat down to eat bread: and they lifted up their eyes and looked, and, behold, a company of Ishmeelites came from Gilead with their camels bearing spicery and balm and myrrh, going to carry it down to Egypt."
Genesis,37,26,Genesis 37:26,narrative,Joseph sold into slavery,"And Judah said unto his brethren, What profit is it if we slay our brother, and conceal his blood?"
Genesis,37,27,Genesis 37:27,narrative,Joseph sold into slavery,"Come, and let us sell him to the Ishmeelites, and let not our hand be upon him; for he is our brother and our flesh. And his brethren were content."
Genesis,37,28,Genesis 37:28,narrative,Joseph sold into slavery,"Then there passed by Midianites merchantmen; and they drew and lifted up Joseph out of the pit, and sold Joseph to the Ishmeelites for twenty pieces of silver: and they brought Joseph into Egypt."
Ruth,1,1,Ruth 1:1,narrative,Ruth and Naomi,"Now it came to pass in the days when the judges ruled, that there was a famine in the land. And a certain man of Bethlehemjudah went to sojourn in the country of Moab, he, and his wife, and his two sons."
Ruth,1,2,Ruth 1:2,narrative,Ruth and Naomi,"And the name of the man was Elimelech, and the name of his wife Naomi, and the name of his two sons Mahlon and Chilion, Ephrathites of Bethlehemjudah. And they came into the country of Moab, and continued there."
Ruth,1,3,Ruth 1:3,narrative,Ruth and Naomi,"And Elimelech Naomi’s husband died; and she was left, and her two sons."
Ruth,1,4,Ruth 1:4,narrative,Ruth and Naomi,"And they took them wives of the women of Moab; the name of the one was Orpah, and the name of the other Ruth: and they dwelled there about ten years."
Ruth,1,5,Ruth 1:5,narrative,Ruth and Naomi,And Mahlon and Chilion died also both of them; and the woman was left of her two sons and her husband.
Ruth,1,6,Ruth 1:6,narrative,Ruth and Naomi,"Then she arose with her daughters in law, that she might return from the country of Moab: for she had heard in the country of Moab how that the LORD had visited his people in giving them bread."
Ruth,1,7,Ruth 1:7,narrative,Ruth and Naomi,"Wherefore she went forth out of the place where she was, and her two daughters in law with her; and they went on the way to return unto the land of Judah."
Ruth,1,8,Ruth 1:8,narrative,Ruth and Naomi,"And Naomi said unto her two daughters in law, Go, return each to her mother’s house: the LORD deal kindly with you, as ye have dealt with the dead, and with me."
Ruth,1,9,Ruth 1:9,narrative,Ruth and Naomi,"The LORD grant you that ye may find rest, each of you in the house of her husband. Then she kissed them; and they lifted up their voice, and wept."
Ruth,1,10,Ruth 1:10,narrative,Ruth and Naomi,"And they said unto her, Surely we will return with thee unto thy people."
Ruth,1,11,Ruth 1:11,narrative,Ruth and Naomi,"And Naomi said, Turn again, my daughters: why will ye go with me? are there yet any more sons in my womb, that they may be your husbands?"
Ruth,1,12,Ruth 1:12,narrative,Ruth and Naomi,"Turn again, my daughters, go your way; for I am too old to have an husband. If I should say, I have hope, if I should have an husband also to night, and should also bear sons;"
Ruth,1,13,Ruth 1:13,narrative,Ruth and Naomi,"Would ye tarry for them till they were grown? would ye stay for them from having husbands? nay, my daughters; for it grieveth me much for your sakes that the hand of the LORD is gone out against me."
Ruth,1,14,Ruth 1:14,narrative,Ruth and Naomi,"And they lifted up their voice, and wept again: and Orpah kissed her mother in law; but Ruth clave unto her."
Ruth,1,15,Ruth 1:15,narrative,Ruth and Naomi,"And she said, Behold, thy sister in law is gone back unto her people, and unto her gods: return thou after thy sister in law."
Ruth,1,16,Ruth 1:16,narrative,Ruth and Naomi,"And Ruth said, Intreat me not to leave thee, or to return from following after thee: for whither thou goest, I will go; and where thou lodgest, I will lodge: thy people shall be my people, and thy God my God:"
Ruth,1,17,Ruth 1:17,narrative,Ruth and Naomi,"Where thou diest, will I die, and there will I be buried: the LORD do so to me, and more also, if ought but death part thee and me."
Ruth,1,18,Ruth 1:18,narrative,Ruth and Naomi,"When she saw that she was stedfastly minded to go with her, then she left speaking unto her."
Ruth,4,9,Ruth 4:9,narrative,Boaz redeems Ruth,"And Boaz said unto the elders, and unto all the people, Ye are witnesses this day, that I have bought all that was Elimelech’s, and all that was Chilion’s and Mahlon’s, of the hand of Naomi."
Ruth,4,10,Ruth 4:10,narrative,Boaz redeems Ruth,"Moreover Ruth the Moabitess, the wife of Mahlon, have I purchased to be my wife, to raise up the name of the dead upon his inheritance, that the name of the dead be not cut off from among his brethren, and from the gate of his place: ye are witnesses this day."
Ruth,4,11,Ruth 4:11,narrative,Boaz redeems Ruth,"And all the people that were in the gate, and the elders, said, We are witnesses. The LORD make the woman that is come into thine house like Rachel and like Leah, which two did build the house of Israel: and do thou worthily in Ephratah, and be famous in Bethlehem:"
Ruth,4,12,Ruth 4:12,narrative,Boaz redeems Ruth,"And let thy house be like the house of Pharez, whom Tamar bare unto Judah, of the seed which the LORD shall give thee of this young woman."
Ruth,4,13,Ruth 4:13,narrative,Boaz redeems Ruth,"So Boaz took Ruth, and she was his wife: and when he went in unto her, the LORD gave her conception, and she bare a son."
Ruth,4,14,Ruth 4:14,narrative,Boaz redeems Ruth,"And the women said unto Naomi, Blessed be the LORD, which hath not left thee this day without a kinsman, that his name may be famous in Israel."
Ruth,4,15,Ruth 4:15,narrative,Boaz redeems Ruth,"And he shall be unto thee a restorer of thy life, and a nourisher of thine old age: for thy daughter in law, which loveth thee, which is better to thee than seven sons, hath born him."
Ruth,4,16,Ruth 4:16,narrative,Boaz redeems Ruth,"And Naomi took the child, and laid it in her bosom, and became nurse unto it."
Ruth,4,17,Ruth 4:17,narrative,Boaz redeems Ruth,"And the women her neighbours gave it a name, saying, There is a son born to Naomi; and they called his name Obed: he is the father of Jesse, the father of David."
Esther,2,15,Esther 2:15,narrative,Esther made queen,"Now when the turn of Esther, the daughter of Abihail the uncle of Mordecai, who had taken her for his daughter, was come to go in unto the king, she required nothing but what Hegai the king’s chamberlain, the keeper of the women, appointed. And Esther obtained favour in the sight of all them that looked upon her."
Esther,2,16,Esther 2:16,narrative,Esther made queen,"So Esther was taken unto king Ahasuerus into his house royal in the tenth month, which is the month Tebeth, in the seventh year of his reign."
Esther,2,17,Esther 2:17,narrative,Esther made queen,"And the king loved Esther above all the women, and she obtained grace and favour in his sight more than all the virgins; so that he set the royal crown upon her head, and made her queen instead of Vashti."
Esther,2,18,Esther 2:18,narrative,Esther made queen,"Then the king made a great feast unto all his princes and his servants, even Esther’s feast; and he made a release to the provinces, and gave gifts, according to the state of the king."
Esther,7,1,Esther 7:1,narrative,Haman's downfall,So the king and Haman came to banquet with Esther the queen.
Esther,7,2,Esther 7:2,narrative,Haman's downfall,"And the king said again unto Esther on the second day at the banquet of wine, What is thy petition, queen Esther? and it shall be granted thee: and what is thy request? and it shall be performed, even to the half of the kingdom."
Esther,7,3,Esther 7:3,narrative,Haman's downfall,"Then Esther the queen answered and said, If I have found favour in thy sight, O king, and if it please the king, let my life be given me at my petition, and my people at my request:"
Esther,7,4,Esther 7:4,narrative,Haman's downfall,"For we are sold, I and my people, to be destroyed, to be slain, and to perish. But if we had been sold for bondmen and bondwomen, I had held my tongue, although the enemy could not countervail the king’s damage."
Esther,7,5,Esther 7:5,narrative,Haman's downfall,"Then the king Ahasuerus answered and said unto Esther the queen, Who is he, and where is he, that durst presume in his heart to do so?"
Esther,7,6,Esther 7:6,narrative,Haman's downfall,"And Esther said, The adversary and enemy is this wicked Haman. Then Haman was afraid before the king and the queen."
Esther,7,7,Esther 7:7,narrative,Haman's downfall,And the king arising from the banquet of wine in his wrath went into the palace garden: and Haman stood up to make request for his life to Esther the queen; for he saw that there was evil determined against him by the king.
Esther,7,8,Esther 7:8,narrative,Haman's downfall,"Then the king returned out of the palace garden into the place of the banquet of wine; and Haman was fallen upon the bed whereon Esther was. Then said the king, Will he force the queen also before me in the house? As the word went out of the king’s mouth, they covered Haman’s face."
Esther,7,9,Esther 7:9,narrative,Haman's downfall,"And Harbonah, one of the chamberlains, said before the king, Behold also, the gallows fifty cubits high, which Haman had made for Mordecai, who had spoken good for the king, standeth in the house of Haman. Then the king said, Hang him thereon."
Esther,7,10,Esther 7:10,narrative,Haman's downfall,So they hanged Haman on the gallows that he had prepared for Mordecai. Then was the king’s wrath pacified.
1 Kings,3,16,1 Kings 3:16,narrative,Solomon's judgment,"Then came there two women, that were harlots, unto the king, and stood before him."
1 Kings,3,17,1 Kings 3:17,narrative,Solomon's judgment,"And the one woman said, O my lord, I and this woman dwell in one house; and I was delivered of a child with her in the house."
1 Kings,3,18,1 Kings 3:18,narrative,Solomon's judgment,"And it came to pass the third day after that I was delivered, that this woman was delivered also: and we were together; there was no stranger with us in the house, save we two in the house."
1 Kings,3,19,1 Kings 3:19,narrative,Solomon's judgment,And this woman’s child died in the night; because she overlaid it.
1 Kings,3,20,1 Kings 3:20,narrative,Solomon's judgment,"And she arose at midnight, and took my son from beside me, while thine handmaid slept, and laid it in her bosom, and laid her dead child in my bosom."
1 Kings,3,21,1 Kings 3:21,narrative,Solomon's judgment,"And when I rose in the morning to give my child suck, behold, it was dead: but when I had considered it in the morning, behold, it was not my son, which I did bear."
1 Kings,3,22,1 Kings 3:22,narrative,Solomon's judgment,"And the other woman said, Nay; but the living is my son, and the dead is thy son. And this said, No; but the dead is thy son, and the living is my son. Thus they spake before the king."
1 Kings,3,23,1 Kings 3:23,narrative,Solomon's judgment,"Then said the king, The one saith, This is my son that liveth, and thy son is the dead: and the other saith, Nay; but thy son is the dead, and my son is the living."
1 Kings,3,24,1 Kings 3:24,narrative,Solomon's judgment,"And the king said, Bring me a sword. And they brought a sword before the king."
1 Kings,3,25,1 Kings 3:25,narrative,Solomon's judgment,"And the king said, Divide the living child in two, and give half to the one, and half to the other."
1 Kings,3,26,1 Kings 3:26,narrative,Solomon's judgment,"Then spake the woman whose the living child was unto the king, for her bowels yearned upon her son, and she said, O my lord, give her the living child, and in no wise slay it. But the other said, Let it be neither mine nor thine, but divide it."
1 Kings,3,27,1 Kings 3:27,narrative,Solomon's judgment,"Then the king answered and said, Give her the living child, and in no wise slay it: she is the mother thereof."
1 Kings,3,28,1 Kings 3:28,narrative,Solomon's judgment,"And all Israel heard of the judgment which the king had judged; and they feared the king: for they saw that the wisdom of God was in him, to do judgment."
2 Kings,5,1,2 Kings 5:1,narrative,Naaman healed,"Now Naaman, captain of the host of the king of Syria, was a great man with his master, and honourable, because by him the LORD had given deliverance unto Syria: he was also a mighty man in valour, but he was a leper."
2 Kings,5,2,2 Kings 5:2,narrative,Naaman healed,"And the Syrians had gone out by companies, and had brought away captive out of the land of Israel a little maid; and she waited on Naaman’s wife."
2 Kings,5,3,2 Kings 5:3,narrative,Naaman healed,"And she said unto her mistress, Would God my lord were with the prophet that is in Samaria! for he would recover him of his leprosy."
2 Kings,5,4,2 Kings 5:4,narrative,Naaman healed,"And one went in, and told his lord, saying, Thus and thus said the maid that is of the land of Israel."
2 Kings,5,5,2 Kings 5:5,narrative,Naaman healed,"And the king of Syria said, Go to, go, and I will send a letter unto the king of Israel. And he departed, and took with him ten talents of silver, and six thousand pieces of gold, and ten changes of raiment."
2 Kings,5,6,2 Kings 5:6,narrative,Naaman healed,"And he brought the letter to the king of Israel, saying, Now when this letter is come unto thee, behold, I have therewith sent Naaman my servant to thee, that thou mayest recover him of his leprosy."
2 Kings,5,7,2 Kings 5:7,narrative,Naaman healed,"And it came to pass, when the king of Israel had read the letter, that he rent his clothes, and said, Am I God, to kill and to make alive, that this man doth send unto me to recover a man of his leprosy? wherefore consider, I pray you, and see how he seeketh a quarrel against me."
2 Kings,5,8,2 Kings 5:8,narrative,Naaman healed,"And it was so, when Elisha the man of God had heard that the king of Israel had rent his clothes, that he sent to the king, saying, Wherefore hast thou rent thy clothes? let him come now to me, and he shall know that there is a prophet in Israel."
2 Kings,5,9,2 Kings 5:9,narrative,Naaman healed,"So Naaman came with his horses and with his chariot, and stood at the door of the house of Elisha."
2 Kings,5,10,2 Kings 5:10,narrative,Naaman healed,"And Elisha sent a messenger unto him, saying, Go and wash in Jordan seven times, and thy flesh shall come again to thee, and thou shalt be clean."
2 Kings,5,11,2 Kings 5:11,narrative,Naaman healed,"But Naaman was wroth, and went away, and said, Behold, I thought, He will surely come out to me, and stand, and call on the name of the LORD his God, and strike his hand over the place, and recover the leper."
2 Kings,5,12,2 Kings 5:12,narrative,Naaman healed,"Are not Abana and Pharpar, rivers of Damascus, better than all the waters of Israel? may I not wash in them, and be clean? So he turned and went away in a rage."
2 Kings,5,13,2 Kings 5:13,narrative,Naaman healed,"And his servants came near, and spake unto him, and said, My father, if the prophet had bid thee do some great thing, wouldest thou not have done it? how much rather then, when he saith to thee, Wash, and be clean?"
2 Kings,5,14,2 Kings 5:14,narrative,Naaman healed,"Then went he down, and dipped himself seven times in Jordan, according to the saying of the man of God: and his flesh came again like unto the flesh of a little child, and he was clean."
2 Chronicles,34,1,2 Chronicles 34:1,narrative,Josiah's reforms (narrated account),"Josiah was eight years old when he began to reign, and he reigned in Jerusalem one and thirty years."
2 Chronicles,34,2,2 Chronicles 34:2,narrative,Josiah's reforms (narrated account),"And he did that which was right in the sight of the LORD, and walked in the ways of David his father, and declined neither to the right hand, nor to the left."
2 Chronicles,34,3,2 Chronicles 34:3,narrative,Josiah's reforms (narrated account),"For in the eighth year of his reign, while he was yet young, he began to seek after the God of David his father: and in the twelfth year he began to purge Judah and Jerusalem from the high places, and the groves, and the carved images, and the molten images."
2 Chronicles,34,4,2 Chronicles 34:4,narrative,Josiah's reforms (narrated account),"And they brake down the altars of Baalim in his presence; and the images, that were on high above them, he cut down; and the groves, and the carved images, and the molten images, he brake in pieces, and made dust of them, and strowed it upon the graves of them that had sacrificed unto them."
2 Chronicles,34,5,2 Chronicles 34:5,narrative,Josiah's reforms (narrated account),"And he burnt the bones of the priests upon their altars, and cleansed Judah and Jerusalem."
2 Chronicles,34,6,2 Chronicles 34:6,narrative,Josiah's reforms (narrated account),"And so did he in the cities of Manasseh, and Ephraim, and Simeon, even unto Naphtali, with their mattocks round about."
2 Chronicles,34,7,2 Chronicles 34:7,narrative,Josiah's reforms (narrated account),"And when he had broken down the altars and the groves, and had beaten the graven images into powder, and cut down all the idols throughout all the land of Israel, he returned to Jerusalem."
2 Chronicles,34,8,2 Chronicles 34:8,narrative,Josiah's reforms (narrated account),"Now in the eighteenth year of his reign, when he had purged the land, and the house, he sent Shaphan the son of Azaliah, and Maaseiah the governor of the city, and Joah the son of Joahaz the recorder, to repair the house of the LORD his God."
2 Chronicles,34,9,2 Chronicles 34:9,narrative,Josiah's reforms (narrated account),"And when they came to Hilkiah the high priest, they delivered the money that was brought into the house of God, which the Levites that kept the doors had gathered of the hand of Manasseh and Ephraim, and of all the remnant of Israel, and of all Judah and Benjamin; and they returned to Jerusalem."
2 Chronicles,34,10,2 Chronicles 34:10,narrative,Josiah's reforms (narrated account),"And they put it in the hand of the workmen that had the oversight of the house of the LORD, and they gave it to the workmen that wrought in the house of the LORD, to repair and amend the house:"
2 Chronicles,34,11,2 Chronicles 34:11,narrative,Josiah's reforms (narrated account),"Even to the artificers and builders gave they it, to buy hewn stone, and timber for couplings, and to floor the houses which the kings of Judah had destroyed."
2 Chronicles,34,12,2 Chronicles 34:12,narrative,Josiah's reforms (narrated account),"And the men did the work faithfully: and the overseers of them were Jahath and Obadiah, the Levites, of the sons of Merari; and Zechariah and Meshullam, of the sons of the Kohathites, to set it forward; and other of the Levites, all that could skill of instruments of musick."
2 Chronicles,34,13,2 Chronicles 34:13,narrative,Josiah's reforms (narrated account),"Also they were over the bearers of burdens, and were overseers of all that wrought the work in any manner of service: and of the Levites there were scribes, and officers, and porters."
Leviticus,11,1,Leviticus 11:1,law-wisdom,dietary law,"And the LORD spake unto Moses and to Aaron, saying unto them,"
Leviticus,11,2,Leviticus 11:2,law-wisdom,dietary law,"Speak unto the children of Israel, saying, These are the beasts which ye shall eat among all the beasts that are on the earth."
Leviticus,11,3,Leviticus 11:3,law-wisdom,dietary law,"Whatsoever parteth the hoof, and is clovenfooted, and cheweth the cud, among the beasts, that shall ye eat."
Leviticus,11,4,Leviticus 11:4,law-wisdom,dietary law,"Nevertheless these shall ye not eat of them that chew the cud, or of them that divide the hoof: as the camel, because he cheweth the cud, but divideth not the hoof; he is unclean unto you."
Leviticus,11,5,Leviticus 11:5,law-wisdom,dietary law,"And the coney, because he cheweth the cud, but divideth not the hoof; he is unclean unto you."
Leviticus,11,6,Leviticus 11:6,law-wisdom,dietary law,"And the hare, because he cheweth the cud, but divideth not the hoof; he is unclean unto you."
Leviticus,11,7,Leviticus 11:7,law-wisdom,dietary law,"And the swine, though he divide the hoof, and be clovenfooted, yet he cheweth not the cud; he is unclean to you."
Leviticus,11,8,Leviticus 11:8,law-wisdom,dietary law,"Of their flesh shall ye not eat, and their carcase shall ye not touch; they are unclean to you."
Leviticus,19,9,Leviticus 19:9,law-wisdom,holiness code,"And when ye reap the harvest of your land, thou shalt not wholly reap the corners of thy field, neither shalt thou gather the gleanings of thy harvest."
Leviticus,19,10,Leviticus 19:10,law-wisdom,holiness code,"And thou shalt not glean thy vineyard, neither shalt thou gather every grape of thy vineyard; thou shalt leave them for the poor and stranger: I am the LORD your God."
Leviticus,19,11,Leviticus 19:11,law-wisdom,holiness code,"Ye shall not steal, neither deal falsely, neither lie one to another."
Leviticus,19,12,Leviticus 19:12,law-wisdom,holiness code,"And ye shall not swear by my name falsely, neither shalt thou profane the name of thy God: I am the LORD."
Leviticus,19,13,Leviticus 19:13,law-wisdom,holiness code,"Thou shalt not defraud thy neighbour, neither rob him: the wages of him that is hired shall not abide with thee all night until the morning."
Leviticus,19,14,Leviticus 19:14,law-wisdom,holiness code,"Thou shalt not curse the deaf, nor put a stumblingblock before the blind, but shalt fear thy God: I am the LORD."
Leviticus,19,15,Leviticus 19:15,law-wisdom,holiness code,"Ye shall do no unrighteousness in judgment: thou shalt not respect the person of the poor, nor honor the person of the mighty: but in righteousness shalt thou judge thy neighbour."
Leviticus,19,16,Leviticus 19:16,law-wisdom,holiness code,Thou shalt not go up and down as a talebearer among thy people: neither shalt thou stand against the blood of thy neighbour: I am the LORD.
Leviticus,19,17,Leviticus 19:17,law-wisdom,holiness code,"Thou shalt not hate thy brother in thine heart: thou shalt in any wise rebuke thy neighbour, and not suffer sin upon him."
Leviticus,19,18,Leviticus 19:18,law-wisdom,holiness code,"Thou shalt not avenge, nor bear any grudge against the children of thy people, but thou shalt love thy neighbour as thyself: I am the LORD."
Leviticus,23,1,Leviticus 23:1,law-wisdom,feast law,"And the LORD spake unto Moses, saying,"
Leviticus,23,2,Leviticus 23:2,law-wisdom,feast law,"Speak unto the children of Israel, and say unto them, Concerning the feasts of the LORD, which ye shall proclaim to be holy convocations, even these are my feasts."
Leviticus,23,3,Leviticus 23:3,law-wisdom,feast law,"Six days shall work be done: but the seventh day is the sabbath of rest, an holy convocation; ye shall do no work therein: it is the sabbath of the LORD in all your dwellings."
Leviticus,23,4,Leviticus 23:4,law-wisdom,feast law,"These are the feasts of the LORD, even holy convocations, which ye shall proclaim in their seasons."
Leviticus,23,5,Leviticus 23:5,law-wisdom,feast law,In the fourteenth day of the first month at even is the LORD’s passover.
Leviticus,23,6,Leviticus 23:6,law-wisdom,feast law,And on the fifteenth day of the same month is the feast of unleavened bread unto the LORD: seven days ye must eat unleavened bread.
Leviticus,23,7,Leviticus 23:7,law-wisdom,feast law,In the first day ye shall have an holy convocation: ye shall do no servile work therein.
